{"canonicalization":"bir-json-c14n-v1","capture_gaps":[{"gap_id":"metadata-only-taxpayer-payload-xml-encrypted-v1","reason":"The tracked manifest records a dummy save, final-copy, or taxpayer-shaped payload identity; safety policy forbids acquiring its bytes. Declared kind=dummy-profile-encrypted-final-copy, sha256=68108a0a92dd9951e90eba4b56d54e8f2bbbbaefafadc0802a17fad59cfc0bdc, size_bytes=1185.","source_evidence_ids":[],"source_ref":"manifest.json#official_assets/xml-encrypted-v1"},{"gap_id":"serialization-occurrences-not-observed","reason":"No explicit value-free serialization binding inventory is tracked; 126 field keys are projections, 118 serializable occurrences are declared, and the occurrence-count delta is 8.","source_evidence_ids":["sha256-2626eab0f2681bd811d12ae6ed60e177d1961e4f462be5ed453d674f3418671b","sha256-2ccf624c87c8a951443630a0803e5f1f4bd7800bceb850ff14e8160f5f6b59fd","sha256-968ce5e240cfb1ad53ec831d5cd6a94493087bdeefaac88b0d536938cc784062","sha256-de8ef0815509d65189e6794e1f8135a5ecf5f2800005d1fc5c87043efd96dbca","sha256-e591320154a6eeb68f1f7d983d39e0c89b933cf413a1c4d4f01552ab982eae2f"],"source_ref":"fields.json#/runtime_serializable_element_count"},{"gap_id":"source-excerpts-and-black-box-observations-pending","reason":"Static source excerpts and per-form black-box observations remain pending independent review; no official behavior is inferred from this absence.","source_evidence_ids":["sha256-de8ef0815509d65189e6794e1f8135a5ecf5f2800005d1fc5c87043efd96dbca"],"source_ref":"review-ledger#/capture_gaps"}],"capture_sessions":[{"capture_provenance_sha256":"429f6bec5c1a5cf979b2c6c66f6e9ed874176c5e4f85a8e6d1ecdf81e6213e7f","capture_session_id":"validation-rules-all-forms-20260726t155349z","source_map_sha256":"0b939c2414c44c0cedff75f60ad58957edc4402478663089885e551cf4acfbca","source_verification_sha256":"8db9f6811481ecc5ab97e8c96908e49ac0ed92f9ed29f160080ca43d91f8da6e","upstream_evidence_ids":["sha256-2626eab0f2681bd811d12ae6ed60e177d1961e4f462be5ed453d674f3418671b","sha256-2ccf624c87c8a951443630a0803e5f1f4bd7800bceb850ff14e8160f5f6b59fd","sha256-968ce5e240cfb1ad53ec831d5cd6a94493087bdeefaac88b0d536938cc784062","sha256-de8ef0815509d65189e6794e1f8135a5ecf5f2800005d1fc5c87043efd96dbca","sha256-e591320154a6eeb68f1f7d983d39e0c89b933cf413a1c4d4f01552ab982eae2f"]}],"census":{"calculations":{"count":12,"records":[{"json_pointer":"/calculations/0","ordinal":1,"record_id":"2200s-fixed-basic-tax","source_refs":["official-hta-runtime#computeBasicTaxDue:L7388-L7405"]},{"json_pointer":"/calculations/1","ordinal":2,"record_id":"2200s-dynamic-basic-tax","source_refs":["official-hta-runtime#computeSched1BasicTaxDue:L7407-L7438"]},{"json_pointer":"/calculations/2","ordinal":3,"record_id":"2200s-schedule-total","source_refs":["official-hta-runtime#totalTaxDue:L7459-L7528"]},{"json_pointer":"/calculations/3","ordinal":4,"record_id":"2200s-item16","source_refs":["official-hta-runtime#sched1OK:L7530-L7533"]},{"json_pointer":"/calculations/4","ordinal":5,"record_id":"2200s-item17c","source_refs":["official-hta-runtime#compute17C:L7535-L7544"]},{"json_pointer":"/calculations/5","ordinal":6,"record_id":"2200s-item18","source_refs":["official-hta-runtime#compute18:L7546-L7555"]},{"json_pointer":"/calculations/6","ordinal":7,"record_id":"2200s-item20","source_refs":["official-hta-runtime#compute20:L7557-L7581"]},{"json_pointer":"/calculations/7","ordinal":8,"record_id":"2200s-item21d","source_refs":["official-hta-runtime#compute21D:L7583-L7604"]},{"json_pointer":"/calculations/8","ordinal":9,"record_id":"2200s-item22","source_refs":["official-hta-runtime#compute22:L7613-L7635"]},{"json_pointer":"/calculations/9","ordinal":10,"record_id":"2200s-item23b","source_refs":["official-hta-runtime#payPenalties:L7605-L7611"]},{"json_pointer":"/calculations/10","ordinal":11,"record_id":"2200s-item23c","source_refs":["official-hta-runtime#compute23C:L7637-L7646"]},{"json_pointer":"/calculations/11","ordinal":12,"record_id":"2200s-item24","source_refs":["official-hta-runtime#compute24:L7648-L7671"]}]},"declared_counts":{"calculations":12,"fields":126,"unverified_gaps":1,"validations":52},"explicit_gaps":{"count":1,"records":[{"json_pointer":"/declared-gaps/0","ordinal":1,"record_id":null,"source_refs":["gaps.md"]}]},"fields":{"count":126,"records":[{"json_pointer":"/fields/0","ordinal":1,"record_id":"frm2200S:txtMonth1","source_refs":["xml-encrypted-v1#decrypted-field:frm2200S:txtMonth1","official-hta-runtime#control:L442"]},{"json_pointer":"/fields/1","ordinal":2,"record_id":"frm2200S:txtDate","source_refs":["xml-encrypted-v1#decrypted-field:frm2200S:txtDate","official-hta-runtime#control:L458"]},{"json_pointer":"/fields/2","ordinal":3,"record_id":"frm2200S:txtForYr","source_refs":["xml-encrypted-v1#decrypted-field:frm2200S:txtForYr","official-hta-runtime#control:L459"]},{"json_pointer":"/fields/3","ordinal":4,"record_id":"frm2200S:amendedRtn_1","source_refs":["xml-encrypted-v1#decrypted-field:frm2200S:amendedRtn_1","official-hta-runtime#control:L476"]},{"json_pointer":"/fields/4","ordinal":5,"record_id":"frm2200S:amendedRtn_2","source_refs":["xml-encrypted-v1#decrypted-field:frm2200S:amendedRtn_2","official-hta-runtime#control:L477"]},{"json_pointer":"/fields/5","ordinal":6,"record_id":"frm2200S:txtSheets","source_refs":["xml-encrypted-v1#decrypted-field:frm2200S:txtSheets","official-hta-runtime#control:L492"]},{"json_pointer":"/fields/6","ordinal":7,"record_id":"frm2200S:txtTIN1","source_refs":["xml-encrypted-v1#decrypted-field:frm2200S:txtTIN1","official-hta-runtime#control:L528"]},{"json_pointer":"/fields/7","ordinal":8,"record_id":"frm2200S:txtTIN2","source_refs":["xml-encrypted-v1#decrypted-field:frm2200S:txtTIN2","official-hta-runtime#control:L529"]},{"json_pointer":"/fields/8","ordinal":9,"record_id":"frm2200S:txtTIN3","source_refs":["xml-encrypted-v1#decrypted-field:frm2200S:txtTIN3","official-hta-runtime#control:L530"]},{"json_pointer":"/fields/9","ordinal":10,"record_id":"frm2200S:txtBranchCode","source_refs":["xml-encrypted-v1#decrypted-field:frm2200S:txtBranchCode","official-hta-runtime#control:L531"]},{"json_pointer":"/fields/10","ordinal":11,"record_id":"frm2200S:txtRDOCode","source_refs":["xml-encrypted-v1#decrypted-field:frm2200S:txtRDOCode","official-hta-runtime#control:L8000"]},{"json_pointer":"/fields/11","ordinal":12,"record_id":"frm2200S:taxpayerName","source_refs":["xml-encrypted-v1#decrypted-field:frm2200S:taxpayerName","official-hta-runtime#control:L571"]},{"json_pointer":"/fields/12","ordinal":13,"record_id":"frm2200S:txtAddress","source_refs":["xml-encrypted-v1#decrypted-field:frm2200S:txtAddress","official-hta-runtime#control:L602"]},{"json_pointer":"/fields/13","ordinal":14,"record_id":"frm2200S:txtZipCode","source_refs":["xml-encrypted-v1#decrypted-field:frm2200S:txtZipCode","official-hta-runtime#control:L616"]},{"json_pointer":"/fields/14","ordinal":15,"record_id":"frm2200S:txtTelNum","source_refs":["xml-encrypted-v1#decrypted-field:frm2200S:txtTelNum","official-hta-runtime#control:L646"]},{"json_pointer":"/fields/15","ordinal":16,"record_id":"frm2200S:txtLineBus","source_refs":["xml-encrypted-v1#decrypted-field:frm2200S:txtLineBus","official-hta-runtime#control:L669"]},{"json_pointer":"/fields/16","ordinal":17,"record_id":"frm2200S:txtPSIC","source_refs":["xml-encrypted-v1#decrypted-field:frm2200S:txtPSIC","official-hta-runtime#control:L692"]},{"json_pointer":"/fields/17","ordinal":18,"record_id":"txtEmail","source_refs":["xml-encrypted-v1#decrypted-field:txtEmail","official-hta-runtime#control:L725"]},{"json_pointer":"/fields/18","ordinal":19,"record_id":"frm2200SoptRegion","source_refs":["xml-encrypted-v1#decrypted-field:frm2200SoptRegion","official-hta-runtime#control:L752"]},{"json_pointer":"/fields/19","ordinal":20,"record_id":"frm2200SoptProvince","source_refs":["xml-encrypted-v1#decrypted-field:frm2200SoptProvince","official-hta-runtime#control:L757"]},{"json_pointer":"/fields/20","ordinal":21,"record_id":"frm2200SoptCity","source_refs":["xml-encrypted-v1#decrypted-field:frm2200SoptCity","official-hta-runtime#control:L762"]},{"json_pointer":"/fields/21","ordinal":22,"record_id":"frm2200SoptRegion1","source_refs":["xml-encrypted-v1#decrypted-field:frm2200SoptRegion1","official-hta-runtime#control:L789"]},{"json_pointer":"/fields/22","ordinal":23,"record_id":"frm2200SoptProvince1","source_refs":["xml-encrypted-v1#decrypted-field:frm2200SoptProvince1","official-hta-runtime#control:L793"]},{"json_pointer":"/fields/23","ordinal":24,"record_id":"frm2200SoptCity1","source_refs":["xml-encrypted-v1#decrypted-field:frm2200SoptCity1","official-hta-runtime#control:L798"]},{"json_pointer":"/fields/24","ordinal":25,"record_id":"frm2200S:optTreaty_1","source_refs":["xml-encrypted-v1#decrypted-field:frm2200S:optTreaty_1","official-hta-runtime#control:L819"]},{"json_pointer":"/fields/25","ordinal":26,"record_id":"frm2200S:optTreaty_2","source_refs":["xml-encrypted-v1#decrypted-field:frm2200S:optTreaty_2","official-hta-runtime#control:L823"]},{"json_pointer":"/fields/26","ordinal":27,"record_id":"frm2200S:lstTaxTreaty","source_refs":["xml-encrypted-v1#decrypted-field:frm2200S:lstTaxTreaty","official-hta-runtime#control:L833"]},{"json_pointer":"/fields/27","ordinal":28,"record_id":"frm2200S:chkPymntManner_1","source_refs":["xml-encrypted-v1#decrypted-field:frm2200S:chkPymntManner_1","official-hta-runtime#control:L860"]},{"json_pointer":"/fields/28","ordinal":29,"record_id":"frm2200S:chkPymntManner_2","source_refs":["xml-encrypted-v1#decrypted-field:frm2200S:chkPymntManner_2","official-hta-runtime#control:L868"]},{"json_pointer":"/fields/29","ordinal":30,"record_id":"frm2200S:chkPymntManner_3","source_refs":["xml-encrypted-v1#decrypted-field:frm2200S:chkPymntManner_3","official-hta-runtime#control:L876"]},{"json_pointer":"/fields/30","ordinal":31,"record_id":"frm2200S:txtOthMannerofPymnt","source_refs":["xml-encrypted-v1#decrypted-field:frm2200S:txtOthMannerofPymnt","official-hta-runtime#control:L878"]},{"json_po